{
  "schema_version": 1,
  "asset_id": "hero-gt",
  "asset_kind": "vehicle",
  "authorship": {
    "creator": "Randroid's Dojo",
    "creation_date": "2026-07-18",
    "method": "Project-original deterministic procedural Blender model",
    "creation_script": "tools/vehicles/create_hero_gt.py",
    "creation_script_sha256": "ff70cb1c91989ddab1de71a9b9928bbcbb50e3f0ff1f7844d72c1caf3feb1daf"
  },
  "license": {
    "spdx": "CC0-1.0",
    "redistributable": true,
    "status": "pending-human-review",
    "attribution": "Cannonball-Vibe project-original Hero GT; no third-party source art"
  },
  "source": {
    "path": "data/assets/vehicles/sources/hero-gt.blend",
    "sha256": "a87a0ea01e5a920de477e1d3a821a68c7c1fe486470c37a3fc3693e8f78b3bd7",
    "kind": "blender-source"
  },
  "transformations": [
    {
      "id": "hero-gt-blender-export-v1",
      "tool": "Blender",
      "tool_version": "5.1.2+ec6e62d40fa9",
      "script": "tools/vehicles/validate_and_export_hero_gt.py",
      "script_sha256": "ef896c2108ac0bb19fe93655aece2e89724e0e39aa7049a8861f91c20642ce92",
      "profile": "tools/assets/profiles/gltf2-binary-v3.json",
      "profile_sha256": "9183cbf5f5c25a0e5da826962b5bdb60271569396fde56bf4b313498d7b9ee63",
      "inputs": [
        {
          "path": "data/assets/vehicles/sources/hero-gt.blend",
          "sha256": "a87a0ea01e5a920de477e1d3a821a68c7c1fe486470c37a3fc3693e8f78b3bd7",
          "kind": "blender-source"
        }
      ]
    },
    {
      "id": "hero-gt-godot-normalization-v1",
      "tool": "Godot",
      "tool_version": "4.7.1.stable.mono.official.a13da4feb",
      "script": "tools/vehicles/pack_imported_scene.gd",
      "script_sha256": "782887c5b3da6ca565b8684385260b0fa523ada2c3416db175d8db65258adb4f",
      "profile": "tools/assets/profiles/godot-4.7.1-v1.json",
      "profile_sha256": "22feccfc894d853a070bbcfd3ba04963165d72adfa918dbfdb657b2dbbfc5645",
      "inputs": [
        {
          "path": "data/assets/vehicles/derived/hero-gt.glb",
          "sha256": "e426453295cdaeaf098290913cf38b6ec118dc595f5164e7aebf02c85f790676",
          "kind": "gltf-binary"
        }
      ]
    },
    {
      "id": "hero-gt-godot-wrapper-validation-v1",
      "tool": "Godot",
      "tool_version": "4.7.1.stable.mono.official.a13da4feb",
      "script": "tools/vehicles/validate_import.gd",
      "script_sha256": "0be505f040e593362e0cf62cdb3ba1c07276f971804680c88aa0024d3087e856",
      "profile": "tools/assets/profiles/godot-4.7.1-v1.json",
      "profile_sha256": "22feccfc894d853a070bbcfd3ba04963165d72adfa918dbfdb657b2dbbfc5645",
      "inputs": [
        {
          "path": "assets/vehicles/hero-gt/hero-gt.generated.tscn",
          "sha256": "2e8dacfdba18665b4b3d9398dc07d25ecedecfbfed9cfec908c4086ddabdc4b8",
          "kind": "godot-generated-scene"
        }
      ]
    }
  ],
  "derived": [
    {
      "path": "data/assets/vehicles/derived/hero-gt.glb",
      "sha256": "e426453295cdaeaf098290913cf38b6ec118dc595f5164e7aebf02c85f790676",
      "kind": "gltf-binary"
    },
    {
      "path": "assets/vehicles/hero-gt/hero-gt.generated.tscn",
      "sha256": "2e8dacfdba18665b4b3d9398dc07d25ecedecfbfed9cfec908c4086ddabdc4b8",
      "kind": "godot-generated-scene"
    },
    {
      "path": "assets/vehicles/hero-gt/hero-gt.generated.textures.json",
      "sha256": "9c797045fe6c8d3d151378f660e7aa273905b458cecc29291b472c9be68dc8d1",
      "kind": "godot-texture-bindings"
    },
    {
      "path": "game/Vehicle/Visuals/HeroGt.tscn",
      "sha256": "b755f98d5609de5982c0f2637b802b2b500f7655d03602c219789569995dd5df",
      "kind": "godot-wrapper"
    },
    {
      "path": "game/Vehicle/VehicleVisualRig.cs",
      "sha256": "1ec0a84f89a47a75f4f230f4136152323373b44d9c05344b49cd538b48f73b22",
      "kind": "runtime-adapter"
    },
    {
      "path": "data/assets/vehicles/hero-gt.glb.import",
      "sha256": "344f39c7ec0929fcc0f7fe3263a9d418d259f7e96499dfaad4342241cc5c1076",
      "kind": "godot-import-settings"
    },
    {
      "path": "data/assets/vehicles/hero-gt-contact-sheet.png",
      "sha256": "f8b68ae26f8205f9f33ff7cd78b5872668d2345e46811add17277f6adec25441",
      "kind": "renderer-contact-sheet"
    },
    {
      "path": "data/assets/vehicles/hero-gt.blender.json",
      "sha256": "0209fbe37f06228042b7462d401e1e6c8a04d98f6c7850303721fcc762087492",
      "kind": "blender-inventory"
    },
    {
      "path": "data/assets/vehicles/hero-gt.godot.json",
      "sha256": "3a0dedb2b63117490f23a67a41b055ce57cbc33d1aea4aeed4e02413d717e96c",
      "kind": "godot-inventory"
    }
  ],
  "semantic_contract": {
    "required_nodes": [
      "AssetRoot",
      "Camera_ChaseTarget",
      "Camera_Cockpit",
      "Chassis",
      "CollisionProxy",
      "Contact_FL",
      "Contact_FR",
      "Contact_RL",
      "Contact_RR",
      "Damage_Front",
      "Damage_Left",
      "Damage_Rear",
      "Damage_Right",
      "Damage_Roof",
      "Driver_Reference",
      "Exhaust_L",
      "Exhaust_R",
      "Light_Head_FL",
      "Light_Head_FR",
      "Light_Tail_RL",
      "Light_Tail_RR",
      "MaterialGroup_Body",
      "MaterialGroup_Glass",
      "MaterialGroup_Interior",
      "MaterialGroup_Lights",
      "MaterialGroup_Wheels",
      "Suspension_FL",
      "Suspension_FR",
      "Suspension_RL",
      "Suspension_RR",
      "Visual_LOD0",
      "Visual_LOD1",
      "Visual_LOD2",
      "Wheel_FL",
      "Wheel_FR",
      "Wheel_RL",
      "Wheel_RR"
    ],
    "forward_axis": "-Z",
    "up_axis": "+Y",
    "unit_meters": 1,
    "bounds_meters": [
      1.9,
      4.48,
      1.53
    ],
    "wrapper_scene": "game/Vehicle/Visuals/HeroGt.tscn",
    "automation_id": "vehicle.hero-gt.visual-rig"
  },
  "budgets": {
    "collision_triangles_max": 128,
    "materials_max": 32,
    "texture_bytes_max": 96000000,
    "textures_max": 48,
    "triangles_lod0_max": 150000,
    "triangles_total_max": 200000
  }
}
